{
  "schema": "gift.author-dialect-supply/1",
  "dialect": {
    "languageId": "gift.semantic-convergence",
    "revision": "design-semantic-boundaries",
    "digest": "sha256:d6caf017eec074a491289100492ebe5c6446b0edbb77eb329128691257ab21bc"
  },
  "issuer": "design-specification-not-a-runtime-authority",
  "definitionKinds": [
    {
      "kind": "extension:definition",
      "bodySchemaRef": "urn:gift:design-schema:semantic-convergence",
      "resultTypeRef": "consumer-signatures.json#/exports/Interpret/result",
      "consumerRef": "consumer-signatures.json#/exports/Interpret"
    }
  ],
  "decoderRef": "SEMANTICS.md#consumer",
  "interpreterRef": "SEMANTICS.md#consumer",
  "typeRulesRef": "SEMANTICS.md#terms",
  "effectRulesRef": "SEMANTICS.md#consumers",
  "compositionRef": "SEMANTICS.md#consumer",
  "migrationRef": "SEMANTICS.md#legacy",
  "evidenceObligations": [
    "SEMANTICS.md#consumers",
    "SEMANTICS.md#model-contract-use",
    "SEMANTICS.md#qualification-transfer"
  ],
  "loweringRefs": [],
  "requiresCapabilities": []
}
